{
  "schema_version": "5.1",
  "kind": "binding",
  "lineage": {
    "spatial_locks": "199b0e37e14f6420957e1bdf22d1ec3c5765fef47a1c445b338dc3ff4b9173f7",
    "assets": "8cf1167a909c2f90510db758ac56a5d70e0cfaa7be640f048388d647292e7158"
  },
  "units": {
    "LOCK_SC01_A01": {
      "P1": {
        "asset_id": "CHAR_A_H3_OFFICE",
        "file": "CHAR_A_H3_OFFICE.png",
        "sha256": "b7f2416bf4f60fe669cb5ea8b471f4bffe16e387cdcf2129f4b36504bbd30e72"
      },
      "P2": {
        "asset_id": "CHAR_B_H3_OFFICE",
        "file": "CHAR_B_H3_OFFICE.png",
        "sha256": "b7f2416bf4f60fe669cb5ea8b471f4bffe16e387cdcf2129f4b36504bbd30e72"
      },
      "P3": {
        "asset_id": "SCN_LIVING_MASTER",
        "file": "SCN_LIVING_MASTER.png",
        "sha256": "b7f2416bf4f60fe669cb5ea8b471f4bffe16e387cdcf2129f4b36504bbd30e72"
      }
    },
    "SEG001": {
      "P1": {
        "asset_id": "CHAR_A_H3_OFFICE",
        "file": "CHAR_A_H3_OFFICE.png",
        "sha256": "b7f2416bf4f60fe669cb5ea8b471f4bffe16e387cdcf2129f4b36504bbd30e72"
      },
      "P2": {
        "asset_id": "CHAR_B_H3_OFFICE",
        "file": "CHAR_B_H3_OFFICE.png",
        "sha256": "b7f2416bf4f60fe669cb5ea8b471f4bffe16e387cdcf2129f4b36504bbd30e72"
      },
      "P3": {
        "asset_id": "SCN_LIVING_MASTER",
        "file": "SCN_LIVING_MASTER.png",
        "sha256": "b7f2416bf4f60fe669cb5ea8b471f4bffe16e387cdcf2129f4b36504bbd30e72"
      }
    },
    "SEG002": {
      "P1": {
        "asset_id": "CHAR_A_H3_OFFICE",
        "file": "CHAR_A_H3_OFFICE.png",
        "sha256": "b7f2416bf4f60fe669cb5ea8b471f4bffe16e387cdcf2129f4b36504bbd30e72"
      },
      "P2": {
        "asset_id": "CHAR_B_H3_OFFICE",
        "file": "CHAR_B_H3_OFFICE.png",
        "sha256": "b7f2416bf4f60fe669cb5ea8b471f4bffe16e387cdcf2129f4b36504bbd30e72"
      },
      "P3": {
        "asset_id": "SCN_LIVING_MASTER",
        "file": "SCN_LIVING_MASTER.png",
        "sha256": "b7f2416bf4f60fe669cb5ea8b471f4bffe16e387cdcf2129f4b36504bbd30e72"
      }
    },
    "LOCK_SC02_A01": {
      "P1": {
        "asset_id": "CHAR_A_H3_OFFICE",
        "file": "CHAR_A_H3_OFFICE.png",
        "sha256": "b7f2416bf4f60fe669cb5ea8b471f4bffe16e387cdcf2129f4b36504bbd30e72"
      },
      "P2": {
        "asset_id": "CHAR_B_H3_OFFICE",
        "file": "CHAR_B_H3_OFFICE.png",
        "sha256": "b7f2416bf4f60fe669cb5ea8b471f4bffe16e387cdcf2129f4b36504bbd30e72"
      },
      "P3": {
        "asset_id": "SCN_LIVING_MASTER",
        "file": "SCN_LIVING_MASTER.png",
        "sha256": "b7f2416bf4f60fe669cb5ea8b471f4bffe16e387cdcf2129f4b36504bbd30e72"
      }
    },
    "SEG003": {
      "P1": {
        "asset_id": "CHAR_A_H3_OFFICE",
        "file": "CHAR_A_H3_OFFICE.png",
        "sha256": "b7f2416bf4f60fe669cb5ea8b471f4bffe16e387cdcf2129f4b36504bbd30e72"
      },
      "P2": {
        "asset_id": "CHAR_B_H3_OFFICE",
        "file": "CHAR_B_H3_OFFICE.png",
        "sha256": "b7f2416bf4f60fe669cb5ea8b471f4bffe16e387cdcf2129f4b36504bbd30e72"
      },
      "P3": {
        "asset_id": "SCN_LIVING_MASTER",
        "file": "SCN_LIVING_MASTER.png",
        "sha256": "b7f2416bf4f60fe669cb5ea8b471f4bffe16e387cdcf2129f4b36504bbd30e72"
      }
    }
  },
  "asset_files": {
    "CHAR_A_H3_OFFICE": {
      "file": "CHAR_A_H3_OFFICE.png",
      "sha256": "b7f2416bf4f60fe669cb5ea8b471f4bffe16e387cdcf2129f4b36504bbd30e72"
    },
    "CHAR_B_H3_OFFICE": {
      "file": "CHAR_B_H3_OFFICE.png",
      "sha256": "b7f2416bf4f60fe669cb5ea8b471f4bffe16e387cdcf2129f4b36504bbd30e72"
    },
    "SCN_LIVING_MASTER": {
      "file": "SCN_LIVING_MASTER.png",
      "sha256": "b7f2416bf4f60fe669cb5ea8b471f4bffe16e387cdcf2129f4b36504bbd30e72"
    }
  }
}
