{
  "schema_version": "5.1",
  "kind": "binding",
  "lineage": {
    "spatial_locks": "ab33edb184de0d4aacb59093b67eb65ff99e0ec2389b803017d723b13aa873cb",
    "assets": "d77dcbbbe1c3be9e55642bb76d1e9d1fe3076fb3344facbefcb51942daa1742b"
  },
  "units": {
    "LOCK_SC01_A01": {
      "P1": {
        "asset_id": "CHAR_A_H3_OFFICE",
        "file": "CHAR_A_H3_OFFICE.png",
        "sha256": "b7f2416bf4f60fe669cb5ea8b471f4bffe16e387cdcf2129f4b36504bbd30e72"
      },
      "P2": {
        "asset_id": "CHAR_B_H3_OFFICE",
        "file": "CHAR_B_H3_OFFICE.png",
        "sha256": "b7f2416bf4f60fe669cb5ea8b471f4bffe16e387cdcf2129f4b36504bbd30e72"
      },
      "P3": {
        "asset_id": "CHAR_C_H3_OFFICE",
        "file": "CHAR_C_H3_OFFICE.png",
        "sha256": "b7f2416bf4f60fe669cb5ea8b471f4bffe16e387cdcf2129f4b36504bbd30e72"
      },
      "P4": {
        "asset_id": "SCN_LIVING_MASTER",
        "file": "SCN_LIVING_MASTER.png",
        "sha256": "b7f2416bf4f60fe669cb5ea8b471f4bffe16e387cdcf2129f4b36504bbd30e72"
      }
    },
    "SEG001": {
      "P1": {
        "asset_id": "CHAR_A_H3_OFFICE",
        "file": "CHAR_A_H3_OFFICE.png",
        "sha256": "b7f2416bf4f60fe669cb5ea8b471f4bffe16e387cdcf2129f4b36504bbd30e72"
      },
      "P2": {
        "asset_id": "CHAR_B_H3_OFFICE",
        "file": "CHAR_B_H3_OFFICE.png",
        "sha256": "b7f2416bf4f60fe669cb5ea8b471f4bffe16e387cdcf2129f4b36504bbd30e72"
      },
      "P3": {
        "asset_id": "CHAR_C_H3_OFFICE",
        "file": "CHAR_C_H3_OFFICE.png",
        "sha256": "b7f2416bf4f60fe669cb5ea8b471f4bffe16e387cdcf2129f4b36504bbd30e72"
      },
      "P4": {
        "asset_id": "SCN_LIVING_MASTER",
        "file": "SCN_LIVING_MASTER.png",
        "sha256": "b7f2416bf4f60fe669cb5ea8b471f4bffe16e387cdcf2129f4b36504bbd30e72"
      }
    },
    "SEG002": {
      "P1": {
        "asset_id": "CHAR_A_H3_OFFICE",
        "file": "CHAR_A_H3_OFFICE.png",
        "sha256": "b7f2416bf4f60fe669cb5ea8b471f4bffe16e387cdcf2129f4b36504bbd30e72"
      },
      "P2": {
        "asset_id": "CHAR_B_H3_OFFICE",
        "file": "CHAR_B_H3_OFFICE.png",
        "sha256": "b7f2416bf4f60fe669cb5ea8b471f4bffe16e387cdcf2129f4b36504bbd30e72"
      },
      "P3": {
        "asset_id": "CHAR_C_H3_OFFICE",
        "file": "CHAR_C_H3_OFFICE.png",
        "sha256": "b7f2416bf4f60fe669cb5ea8b471f4bffe16e387cdcf2129f4b36504bbd30e72"
      },
      "P4": {
        "asset_id": "SCN_LIVING_MASTER",
        "file": "SCN_LIVING_MASTER.png",
        "sha256": "b7f2416bf4f60fe669cb5ea8b471f4bffe16e387cdcf2129f4b36504bbd30e72"
      }
    },
    "SEG003": {
      "P1": {
        "asset_id": "CHAR_A_H3_OFFICE",
        "file": "CHAR_A_H3_OFFICE.png",
        "sha256": "b7f2416bf4f60fe669cb5ea8b471f4bffe16e387cdcf2129f4b36504bbd30e72"
      },
      "P2": {
        "asset_id": "CHAR_B_H3_OFFICE",
        "file": "CHAR_B_H3_OFFICE.png",
        "sha256": "b7f2416bf4f60fe669cb5ea8b471f4bffe16e387cdcf2129f4b36504bbd30e72"
      },
      "P3": {
        "asset_id": "CHAR_C_H3_OFFICE",
        "file": "CHAR_C_H3_OFFICE.png",
        "sha256": "b7f2416bf4f60fe669cb5ea8b471f4bffe16e387cdcf2129f4b36504bbd30e72"
      },
      "P4": {
        "asset_id": "SCN_LIVING_MASTER",
        "file": "SCN_LIVING_MASTER.png",
        "sha256": "b7f2416bf4f60fe669cb5ea8b471f4bffe16e387cdcf2129f4b36504bbd30e72"
      }
    }
  },
  "asset_files": {
    "CHAR_A_H3_OFFICE": {
      "file": "CHAR_A_H3_OFFICE.png",
      "sha256": "b7f2416bf4f60fe669cb5ea8b471f4bffe16e387cdcf2129f4b36504bbd30e72"
    },
    "CHAR_B_H3_OFFICE": {
      "file": "CHAR_B_H3_OFFICE.png",
      "sha256": "b7f2416bf4f60fe669cb5ea8b471f4bffe16e387cdcf2129f4b36504bbd30e72"
    },
    "CHAR_C_H3_OFFICE": {
      "file": "CHAR_C_H3_OFFICE.png",
      "sha256": "b7f2416bf4f60fe669cb5ea8b471f4bffe16e387cdcf2129f4b36504bbd30e72"
    },
    "SCN_LIVING_MASTER": {
      "file": "SCN_LIVING_MASTER.png",
      "sha256": "b7f2416bf4f60fe669cb5ea8b471f4bffe16e387cdcf2129f4b36504bbd30e72"
    }
  }
}
