{
  "schema_version": "5.1",
  "kind": "binding",
  "lineage": {
    "spatial_locks": "b17cd38e5679e60fc7ce6cf8d53f5979a214f27c9921c5232da34ba3aea1f7e7",
    "assets": "c2535f73c001aa97dc7066f711a7bcadf7be5660dd4d337c12296c96e9d655c1"
  },
  "units": {
    "LOCK_SC01_A01": {
      "P1": {
        "asset_id": "CHAR_A_H3_OFFICE",
        "file": "CHAR_A_H3_OFFICE.png",
        "sha256": "b7f2416bf4f60fe669cb5ea8b471f4bffe16e387cdcf2129f4b36504bbd30e72"
      },
      "P2": {
        "asset_id": "CHAR_B_H3_OFFICE",
        "file": "CHAR_B_H3_OFFICE.png",
        "sha256": "b7f2416bf4f60fe669cb5ea8b471f4bffe16e387cdcf2129f4b36504bbd30e72"
      },
      "P3": {
        "asset_id": "SCN_LIVING_MASTER",
        "file": "SCN_LIVING_MASTER.png",
        "sha256": "b7f2416bf4f60fe669cb5ea8b471f4bffe16e387cdcf2129f4b36504bbd30e72"
      },
      "P4": {
        "asset_id": "PROP_SHIRT",
        "file": "PROP_SHIRT.png",
        "sha256": "b7f2416bf4f60fe669cb5ea8b471f4bffe16e387cdcf2129f4b36504bbd30e72"
      }
    },
    "SEG001": {
      "P1": {
        "asset_id": "CHAR_A_H3_OFFICE",
        "file": "CHAR_A_H3_OFFICE.png",
        "sha256": "b7f2416bf4f60fe669cb5ea8b471f4bffe16e387cdcf2129f4b36504bbd30e72"
      },
      "P2": {
        "asset_id": "CHAR_B_H3_OFFICE",
        "file": "CHAR_B_H3_OFFICE.png",
        "sha256": "b7f2416bf4f60fe669cb5ea8b471f4bffe16e387cdcf2129f4b36504bbd30e72"
      },
      "P3": {
        "asset_id": "SCN_LIVING_MASTER",
        "file": "SCN_LIVING_MASTER.png",
        "sha256": "b7f2416bf4f60fe669cb5ea8b471f4bffe16e387cdcf2129f4b36504bbd30e72"
      },
      "P4": {
        "asset_id": "PROP_SHIRT",
        "file": "PROP_SHIRT.png",
        "sha256": "b7f2416bf4f60fe669cb5ea8b471f4bffe16e387cdcf2129f4b36504bbd30e72"
      }
    },
    "SEG002": {
      "P1": {
        "asset_id": "CHAR_A_H3_OFFICE",
        "file": "CHAR_A_H3_OFFICE.png",
        "sha256": "b7f2416bf4f60fe669cb5ea8b471f4bffe16e387cdcf2129f4b36504bbd30e72"
      },
      "P2": {
        "asset_id": "CHAR_B_H3_OFFICE",
        "file": "CHAR_B_H3_OFFICE.png",
        "sha256": "b7f2416bf4f60fe669cb5ea8b471f4bffe16e387cdcf2129f4b36504bbd30e72"
      },
      "P3": {
        "asset_id": "SCN_LIVING_MASTER",
        "file": "SCN_LIVING_MASTER.png",
        "sha256": "b7f2416bf4f60fe669cb5ea8b471f4bffe16e387cdcf2129f4b36504bbd30e72"
      },
      "P4": {
        "asset_id": "PROP_SHIRT",
        "file": "PROP_SHIRT.png",
        "sha256": "b7f2416bf4f60fe669cb5ea8b471f4bffe16e387cdcf2129f4b36504bbd30e72"
      }
    },
    "SEG003": {
      "P1": {
        "asset_id": "CHAR_A_H3_OFFICE",
        "file": "CHAR_A_H3_OFFICE.png",
        "sha256": "b7f2416bf4f60fe669cb5ea8b471f4bffe16e387cdcf2129f4b36504bbd30e72"
      },
      "P2": {
        "asset_id": "CHAR_B_H3_OFFICE",
        "file": "CHAR_B_H3_OFFICE.png",
        "sha256": "b7f2416bf4f60fe669cb5ea8b471f4bffe16e387cdcf2129f4b36504bbd30e72"
      },
      "P3": {
        "asset_id": "SCN_LIVING_MASTER",
        "file": "SCN_LIVING_MASTER.png",
        "sha256": "b7f2416bf4f60fe669cb5ea8b471f4bffe16e387cdcf2129f4b36504bbd30e72"
      },
      "P4": {
        "asset_id": "PROP_SHIRT",
        "file": "PROP_SHIRT.png",
        "sha256": "b7f2416bf4f60fe669cb5ea8b471f4bffe16e387cdcf2129f4b36504bbd30e72"
      }
    }
  },
  "asset_files": {
    "CHAR_A_H3_OFFICE": {
      "file": "CHAR_A_H3_OFFICE.png",
      "sha256": "b7f2416bf4f60fe669cb5ea8b471f4bffe16e387cdcf2129f4b36504bbd30e72"
    },
    "CHAR_B_H3_OFFICE": {
      "file": "CHAR_B_H3_OFFICE.png",
      "sha256": "b7f2416bf4f60fe669cb5ea8b471f4bffe16e387cdcf2129f4b36504bbd30e72"
    },
    "SCN_LIVING_MASTER": {
      "file": "SCN_LIVING_MASTER.png",
      "sha256": "b7f2416bf4f60fe669cb5ea8b471f4bffe16e387cdcf2129f4b36504bbd30e72"
    },
    "PROP_SHIRT": {
      "file": "PROP_SHIRT.png",
      "sha256": "b7f2416bf4f60fe669cb5ea8b471f4bffe16e387cdcf2129f4b36504bbd30e72"
    }
  }
}
